brand,source,date,combined_text,cleaned_text,title,url,finbert_label,finbert_confidence,topic,topic_confidence,sentiment_score,weighted_sentiment,funding,discounts,technology,logistics,customer_complaints,expansion,competition,partnership,other,topic_concentration,external_trend_score,trend_score,trend_velocity,trend_acceleration,trend_sentiment_signal,final_trend_score
h&m india,Nature.com,2026-03-30,"Global, regional and national burden of ischemic heart disease attributable to suboptimal diet, 1990–2023: a Global Burden of Disease study Global Burden of Disease analysis found that in 2023, suboptimal diet was estimated to be responsible for 4 million deaths and 97 million morbidity burdens from ischemic heart disease.",global regional national burden ischemic heart disease attributable suboptimal diet global burden disease study global burden disease analysis found suboptimal diet estimated responsible million deaths million morbidity burdens ischemic heart disease,"Global, regional and national burden of ischemic heart disease attributable to suboptimal diet, 1990–2023: a Global Burden of Disease study",https://www.nature.com/articles/s41591-026-04250-8,neutral,0.7826155424118042,other,0.8,0,0.0,0,0,0,0,0,0,0,0,1,0.027644561766083334,0.0672266592733917,0.5,0.0,0.0,0.0,0.24033599556403504
lenskart,The Times of India,2026-03-11,"Walmart-backed Flipkart to invite banks for IPO pitch in April Flipkart IPO: Flipkart is moving towards a public listing. Banks will be invited to pitch for work on its potential initial public offering as soon as next month. The e-commerce giant, backed by Walmart, is gauging investor appetite for a listing in Mumbai. A…",walmartbacked flipkart invite banks ipo pitch april flipkart ipo flipkart moving towards public listing banks invited pitch work potential initial public offering soon next month ecommerce giant backed walmart gauging investor appetite listing mumbai,Walmart-backed Flipkart to invite banks for IPO pitch in April,https://economictimes.indiatimes.com/markets/ipos/fpos/walmart-backed-flipkart-to-invite-banks-for-ipo-pitch-in-april/articleshow/129446240.cms,neutral,0.8371166586875916,discounts,1.0,0,0.0,0,1,0,0,0,0,0,0,0,0.1954220291755751,0.525132097242432,0.5,0.0,0.0,0.0,0.5150792583454592
lenskart,Livemint,2026-03-12,"Private credit fuels founder buybacks ahead of public listings India’s private credit market has expanded rapidly, with a wave of domestic and global investment firms offering faster, more flexible capital than traditional lenders can provide to companies. Promoters are tapping these funds to shore up shareholding or all…",private credit fuels founder buybacks ahead public listings indias private credit market expanded rapidly wave domestic global investment firms offering faster flexible capital traditional lenders provide companies promoters tapping funds shore shareholding,Private credit fuels founder buybacks ahead of public listings,https://www.livemint.com/companies/promoters-tap-private-credit-firms-to-up-stake-prior-to-public-market-listing-11773123317062.html,positive,0.9136921167373656,discounts,1.0,1,0.9136921167373656,0,1,0,0,0,0,0,0,0,0.11658312269686721,0.5198410937437677,0.7284230291843414,0.22842302918434143,0.0,0.20870832104700196,0.6032738679199972
lenskart,The Times of India,2026-03-17,"Half of new-age listings fall below issue price amid market volatility New-age firms listed over the past year remain under pressure from US-Iran tensions and volatile markets, with many trading below issue price. In addition, PhonePe delaying its IPO may impact others. While a few stocks show gains, several continue to struggle…",half newage listings fall issue price amid market volatility newage firms listed past year remain pressure usiran tensions volatile markets many trading issue price addition phonepe delaying ipo may impact others stocks show gains several continue struggle,Half of new-age listings fall below issue price amid market volatility,https://economictimes.indiatimes.com/tech/technology/half-of-new-age-listings-fall-below-issue-price-amid-market-volatility/articleshow/129632337.cms,negative,0.9577869176864624,customer_complaints,1.0,-1,-0.9577869176864624,0,0,0,0,1,0,0,0,0,0.07927411758426793,0.4444442938878014,0.4926508665084839,-0.23577216267585754,-0.464195191860199,0.2258194929655808,0.46372692293607437
lenskart,MediaNama.com,2026-03-25,"AI, Agents and the new frontiers of privacy AI is changing privacy in ways that are easy to miss, but hard to ignore once you see them.
The post AI, Agents and the new frontiers of privacy appeared first on MEDIANAMA.",ai agents new frontiers privacy ai changing privacy ways easy miss hard ignore see post ai agents new frontiers privacy appeared first medianama,"AI, Agents and the new frontiers of privacy",https://www.medianama.com/2026/03/223-ai-agents-privacy-new-frontiers/,neutral,0.9184272885322572,technology,1.0,0,0.0,0,0,1,0,0,0,0,0,0,0.0040724260309537574,0.3915342589011584,0.4926508665084839,0.0,0.23577216267585754,0.0,0.43198090194408856
lenskart,BusinessLine,2026-03-29,"How D2C firms must adapt to find buyers in the AI era Discover how D2C firms can thrive in the AI era by focusing on brand recall, storytelling, and direct customer relationships.",dc firms must adapt find buyers ai era discover dc firms thrive ai era focusing brand recall storytelling direct customer relationships,How D2C firms must adapt to find buyers in the AI era,https://www.thehindubusinessline.com/specials/emerging-entrepreneurs/how-d2c-firms-must-adapt-to-find-buyers-in-the-ai-era/article70800350.ece,neutral,0.8453895449638367,technology,1.0,0,0.0,0,0,1,0,0,0,0,0,0,0.08079458044644115,0.3055554520478634,0.3403688470522563,-0.1522820194562276,-0.1522820194562276,-0.0,0.3194808100496206
meesho,Lokmattimes.com,2026-03-19,"Google, Microsoft, Amazon Top Gen Z's Dream Employer List: Insights from 37,000+ Students in Unstop Talent Report 2026 - www.lokmattimes.com Google, Microsoft, Amazon Top Gen Z's Dream Employer List: Insights from 37,000+ Students in Unstop Talent Report 2026 - India PR Distribution New Delhi [India], March 19: The report highlights Gen Z's most desirable or ""dream"" companies across ... - Latest N…",google microsoft amazon top gen zs dream employer list insights students unstop talent report google microsoft amazon top gen zs dream employer list insights students unstop talent report india pr distribution new delhi india march report highlights gen zs desirable dream companies across latest n,"Google, Microsoft, Amazon Top Gen Z's Dream Employer List: Insights from 37,000+ Students in Unstop Talent Report 2026 - www.lokmattimes.com",https://www.lokmattimes.com/business/google-microsoft-amazon-top-gen-zs-dream-employer-list-insights-from-37000-students-in-unstop-talent-report-2026/,neutral,0.871484100818634,other,0.8,0,0.0,0,0,0,0,0,0,0,0,1,0.22717467620479642,0.5624978563396171,0.5,0.0,0.0,0.0,0.5374987138037703
meesho,The Times of India,2026-03-19,"Uni’s valuation slashed; Howard Morgan on AI, venture investing, more Happy Thursday! Fintech startup Uni is staring at a steep valuation cut as it looks to raise fresh capital amid regulatory headwinds. This and more in today’s ETtech Morning Dispatch.",unis valuation slashed howard morgan ai venture investing happy thursday fintech startup uni staring steep valuation cut looks raise fresh capital amid regulatory headwinds todays ettech morning dispatch,"Uni’s valuation slashed; Howard Morgan on AI, venture investing, more",https://economictimes.indiatimes.com/tech/newsletters/morning-dispatch/unis-valuation-slashed-howard-morgan-on-ai-venture-investing-more/articleshow/129668684.cms,positive,0.6039797067642212,funding,1.0,1,0.6039797067642212,1,0,0,0,0,0,0,0,0,0.22717467620479642,0.5624978563396171,0.6509949266910553,0.1509949266910553,0.0,0.09119787154574865,0.5978966844801924
meesho,The Times of India,2026-03-19,"Exclusive: AI boom due for correction, strongest firms will endure: First Round Capital cofounder Howard Morgan In venture investing there are two ways to make money—buy low and sell high, or buy high and sell higher. In a bubble, everybody thinks buy high, sell higher works forever. But that only works inside the bubble. As soon as the bubble bursts, you go back to ne…",exclusive ai boom due correction strongest firms endure first round capital cofounder howard morgan venture investing two ways make moneybuy low sell high buy high sell higher bubble everybody thinks buy high sell higher works forever works inside bubble soon bubble bursts go back ne,"Exclusive: AI boom due for correction, strongest firms will endure: First Round Capital cofounder Howard Morgan",https://economictimes.indiatimes.com/tech/artificial-intelligence/ai-boom-will-correct-but-strongest-companies-will-emerge-stronger-first-round-cofounder-howard-morgan/articleshow/129664235.cms,neutral,0.8572426438331604,funding,1.0,0,0.0,1,0,0,0,0,0,0,0,0,0.22717467620479642,0.5624978563396171,0.6006632844607035,-0.0503316422303518,-0.2013265689214071,-0.0,0.5777640275880517
meesho,The Times of India,2026-03-23,"Market rout drags down startup stocks; Lenskart, Ather, Bluestone among big losers New-age companies listed recently stayed under pressure as markets fell sharply on Monday. Sensex and Nifty dropped heavily amid geopolitical tensions, weak global cues, and a falling rupee. Most stocks declined, while few gained. Rising oil prices and foreig…",market rout drags startup stocks lenskart ather bluestone among big losers newage companies listed recently stayed pressure markets fell sharply monday sensex nifty dropped heavily amid geopolitical tensions weak global cues falling rupee stocks declined gained rising oil prices foreig,"Market rout drags down startup stocks; Lenskart, Ather, Bluestone among big losers",https://economictimes.indiatimes.com/tech/startups/market-rout-drags-down-startup-stocks-lenskart-ather-bluestone-among-big-losers/articleshow/129750620.cms,negative,0.9367853999137878,technology,1.0,-1,-0.9367853999137878,0,0,1,0,0,0,0,0,0,0.12817851782797157,0.4642839449152396,0.4445323844750722,-0.1561308999856313,-0.10579925775527949,0.14626114758193923,0.45638332073917265
meesho,The Times of India,2026-03-24,"Meesho launches Gen-AI voice agent Vaani targeting tier-II, III users The company said over 1.5 million users have already interacted with the assistant within a month of launch, with those using it showing a 22% higher conversion rate and lower returns and cancellations.",meesho launches genai voice agent vaani targeting tierii iii users company said million users already interacted assistant within month launch using showing higher conversion rate lower returns cancellations,"Meesho launches Gen-AI voice agent Vaani targeting tier-II, III users",https://economictimes.indiatimes.com/tech/startups/meesho-launches-gen-ai-voice-agent-vaani-targeting-tier-ii-iii-users/articleshow/129771447.cms,positive,0.626385509967804,expansion,1.0,1,0.626385509967804,0,0,0,0,0,1,0,0,0,0.0,0.4404745118426632,0.4482666850090027,0.003734300533930479,0.15986520051956177,0.0023391117443190856,0.44359138110919893
meesho,BusinessLine,2026-03-24,"Meesho bets on AI voice assistant ‘Vaani’ to onboard next 500 million users The company is targeting a segment it believes remains largely underserved by digital commerce — users who are not defined by age or geography, but by their limited comfort with technology.",meesho bets ai voice assistant vaani onboard next million users company targeting segment believes remains largely underserved digital commerce users defined age geography limited comfort technology,Meesho bets on AI voice assistant ‘Vaani’ to onboard next 500 million users,https://www.thehindubusinessline.com/companies/meesho-bets-on-ai-voice-assistant-vaani-to-onboard-next-500-million-users/article70780132.ece,neutral,0.8601492643356323,technology,1.0,0,0.0,0,0,1,0,0,0,0,0,0,0.0,0.4404745118426632,0.4482666850090027,0.0,-0.003734300533930479,0.0,0.44359138110919893
meesho,BusinessLine,2026-03-24,"Meesho launches Gen-AI voice shopping assistant ‘Vaani’ to tap estimated 500 million potential users E-commerce platform Meesho on Tuesday announced the launch of 'Vaani', a generative AI-powered conversational voice shopping assistant, as it looks to target what it estimates to be a market of 500 million potential users who currently do not shop online.",meesho launches genai voice shopping assistant vaani tap estimated million potential users ecommerce platform meesho tuesday announced launch vaani generative aipowered conversational voice shopping assistant looks target estimates market million potential users currently shop online,Meesho launches Gen-AI voice shopping assistant ‘Vaani’ to tap estimated 500 million potential users,https://www.thehindubusinessline.com/companies/meesho-launches-gen-ai-voice-shopping-assistant-vaani-to-tap-estimated-500-million-potential-users/article70778928.ece,neutral,0.7979125380516052,expansion,1.0,0,0.0,0,0,0,0,0,1,0,0,0,0.0,0.4404745118426632,0.604397584994634,0.15613089998563134,0.15613089998563134,0.0,0.5060437411034515
meesho,Livemint,2026-03-25,"Prosus sees long runway in India portfolio Through 2025, Prosus deployed $675 million in companies such as Urban Company, PayU, Rapido, Ixigo, Wiom, Deccan AI, CodeKarma and Arivihan.",prosus sees long runway india portfolio prosus deployed million companies urban company payu rapido ixigo wiom deccan ai codekarma arivihan,Prosus sees long runway in India portfolio,https://www.livemint.com/companies/start-ups/prosus-india-investments-startup-investments-india-urban-company-payu-rapido-11774324102149.html,neutral,0.9039531350135804,technology,1.0,0,0.0,0,0,1,0,0,0,0,0,0,0.0040724260309537574,0.4196412579041589,0.5,-0.10439758499463403,-0.2605284849802654,-0.0,0.45178475474249535
meesho,Livemint,2026-03-25,"Meesho bets on AI voice assistant ‘Vaani’ to boost small-town shopping On Wednesday, Meesho rolled out a conversational voice assistant, “Vaani”, aimed at making online shopping more intuitive for users who prefer conversational, offline-style interactions. The move reflects a broader shift in how the company is thinking about g…",meesho bets ai voice assistant vaani boost smalltown shopping wednesday meesho rolled conversational voice assistant vaani aimed making online shopping intuitive users prefer conversational offlinestyle interactions move reflects broader shift company thinking g,Meesho bets on AI voice assistant ‘Vaani’ to boost small-town shopping,https://www.livemint.com/companies/meesho-launches-ai-voice-assistant-vaani-to-boost-ecommerce-discovery-11774417218768.html,neutral,0.8410400748252869,technology,1.0,0,0.0,0,0,1,0,0,0,0,0,0,0.0040724260309537574,0.4196412579041589,0.5,0.0,0.10439758499463403,0.0,0.45178475474249535
meesho,BusinessLine,2026-03-26,"Insurtech platform Plum bags ₹193 crore in a Series B funding round led by Peak XV Partners The company reported revenue of ₹13.9 crore in FY2024-25, a 69% decline from ₹45.3 crore the previous year; However, net losses decreased by 52% to ₹12.2 crore, according to Tracxn",insurtech platform plum bags crore series b funding round led peak xv partners company reported revenue crore fy decline crore previous year however net losses decreased crore according tracxn,Insurtech platform Plum bags ₹193 crore in a Series B funding round led by Peak XV Partners,https://www.thehindubusinessline.com/money-and-banking/insurtech-platform-plum-bags-193-crore-in-a-series-b-funding-round-led-by-peak-xv-partners/article70788079.ece,positive,0.9121467471122742,funding,1.0,1,0.9121467471122742,1,0,0,0,0,0,0,0,0,0.005211111497220654,0.4047603622337986,0.6520244578520457,0.15202445785204566,0.15202445785204566,0.13866861471125047,0.5036660004810973
meesho,Livemint,2026-03-26,"Plum Insurance raises $20 million, offers partial exit to Incubate Fund Asia The new funding round valued Plum Insurance at $125 million ( ₹1,181 crore), almost double its 2021 valuation of $66 million ( ₹625 crore).",plum insurance raises million offers partial exit incubate fund asia new funding round valued plum insurance million crore almost double valuation million crore,"Plum Insurance raises $20 million, offers partial exit to Incubate Fund Asia",https://www.livemint.com/companies/start-ups/plum-insurance-raises-money-early-investor-exit-valuation-doubles-healthcare-expansion-plans-11774435729326.html,positive,0.5088223218917847,discounts,1.0,1,0.5088223218917847,0,1,0,0,0,0,0,0,0,0.005211111497220654,0.4047603622337986,0.7368281781673431,0.08480372031529748,-0.06722073753674818,0.043150025875891174,0.5375874886072164
meesho,The Times of India,2026-03-26,"Health insurance platform Plum raises $20 million led by Peak XV Plum has raised $20 million (Rs 193 crore) led by Peak XV Partners, with participation from existing investor Tanglin Venture Partners and new investor GMO Venture Partners. The funds will be used in talent, technology, and AI innovation.",health insurance platform plum raises million led peak xv plum raised million rs crore led peak xv partners participation existing investor tanglin venture partners new investor gmo venture partners funds used talent technology ai innovation,Health insurance platform Plum raises $20 million led by Peak XV,https://economictimes.indiatimes.com/tech/funding/health-insurance-platform-plum-raises-20-million-led-by-peak-xv/articleshow/129807773.cms,neutral,0.7893633842468262,funding,1.0,0,0.0,1,0,0,0,0,0,0,0,0,0.005211111497220654,0.4047603622337986,0.7368281781673431,0.0,-0.08480372031529748,0.0,0.5375874886072164
meesho,The Times of India,2026-03-27,"Students placed across 26 cohorts in IIM Ahmedabad's PGP final placements; Boston Consulting Group emerges top recruiter IIM Ahmedabad has successfully completed its final placement process for the PGP Class of 2026. Students secured positions across 26 diverse cohorts and various industry sectors. The private equity, venture capital, and asset management cohort saw a significa…",students placed across cohorts iim ahmedabads pgp final placements boston consulting group emerges top recruiter iim ahmedabad successfully completed final placement process pgp class students secured positions across diverse cohorts various industry sectors private equity venture capital asset management cohort saw significa,Students placed across 26 cohorts in IIM Ahmedabad's PGP final placements; Boston Consulting Group emerges top recruiter,https://economictimes.indiatimes.com/jobs/fresher/students-placed-across-26-cohorts-in-iim-ahmedabads-pgp-final-placements-boston-consulting-group-emerges-top-recruiter/articleshow/129850306.cms,neutral,0.895331621170044,funding,1.0,0,0.0,1,0,0,0,0,0,0,0,0,0.15697472082185235,0.3958318248315824,0.5848037203152975,-0.15202445785204566,-0.15202445785204566,-0.0,0.47142058302506845
meesho,Livemint,2026-03-30,"Trust, not technology, is helping startups make inroads into the Indian hinterland Startups in India focus on trust and technology in targeting small town India. Companies like Wealthy and Supernova have adapted business models to local nuances, highlighting the importance of relationships in non-urban markets. Read on for how they and othe…",trust technology helping startups make inroads indian hinterland startups india focus trust technology targeting small town india companies like wealthy supernova adapted business models local nuances highlighting importance relationships nonurban markets read othe,"Trust, not technology, is helping startups make inroads into the Indian hinterland",https://www.livemint.com/companies/start-ups/india-startups-bharat-tier-2-market-inroads-business-price-conscious-customer-internet-upi-penetration-trust-tech-11774594443932.html,neutral,0.8450609445571899,technology,1.0,0,0.0,0,0,1,0,0,0,0,0,0,0.027644561766083334,0.366070033490862,0.5,-0.08480372031529748,0.06722073753674818,-0.0,0.41964202009451723
meesho,The Times of India,2026-03-30,"Financial services companies buck weak market to rock IPO show Financial services firms achieved record fundraising in FY26, raising ₹49,795 crore through IPOs, the highest in a decade. Despite a struggling finance sector index, these new listings significantly boosted the primary market. Major IPOs from Tata Capital and…",financial services companies buck weak market rock ipo show financial services firms achieved record fundraising fy raising crore ipos highest decade despite struggling finance sector index new listings significantly boosted primary market major ipos tata capital,Financial services companies buck weak market to rock IPO show,https://economictimes.indiatimes.com/markets/ipos/fpos/financial-services-companies-buck-weak-market-to-rock-ipo-show/articleshow/129889244.cms,positive,0.6908538937568665,funding,1.0,1,0.6908538937568665,1,0,0,0,0,0,0,0,0,0.027644561766083334,0.366070033490862,0.6151423156261444,0.11514231562614441,0.1999460359414419,0.07954651708650395,0.465698946344975
myntra,GlobeNewswire,2026-03-11,"Gift Card Business and Investment Intelligence Report 2026: Market to Reach $865 Billion by 2030 - KPIs on Market Size, Retail & Corporate Spend, Competitive Landscape, and Consumer Demographics Key opportunities in the global gift card market include the integration of gift cards into digital wallets and payment platforms, the shift toward programmable spend tools for corporate and B2B gifting, the consolidation into closed-loop ecosystem strategies…",gift card business investment intelligence report market reach billion kpis market size retail corporate spend competitive landscape consumer demographics key opportunities global gift card market include integration gift cards digital wallets payment platforms shift toward programmable spend tools corporate bb gifting consolidation closedloop ecosystem strategies,"Gift Card Business and Investment Intelligence Report 2026: Market to Reach $865 Billion by 2030 - KPIs on Market Size, Retail & Corporate Spend, Competitive Landscape, and Consumer Demographics",https://www.globenewswire.com/news-release/2026/03/11/3253987/28124/en/Gift-Card-Business-and-Investment-Intelligence-Report-2026-Market-to-Reach-865-Billion-by-2030-KPIs-on-Market-Size-Retail-Corporate-Spend-Competitive-Landscape-and-Consumer-Demogra.html,neutral,0.8698341250419617,funding,1.0,0,0.0,1,0,0,0,0,0,0,0,0,0.1954220291755751,0.7074746119853836,0.5,0.0,0.0,0.0,0.6244847671912301
myntra,BusinessLine,2026-03-13,Swiggy and HDFC Bank Elevate Everyday and Travel Rewards with the Launch of Two New Co-branded Credit Cards Swiggy and HDFC Bank Elevate Everyday and Travel Rewards with the Launch of Two New Co-branded Credit Cards,swiggy hdfc bank elevate everyday travel rewards launch two new cobranded credit cards swiggy hdfc bank elevate everyday travel rewards launch two new cobranded credit cards,Swiggy and HDFC Bank Elevate Everyday and Travel Rewards with the Launch of Two New Co-branded Credit Cards,https://www.thehindubusinessline.com/brandhub/pr-release/swiggy-and-hdfc-bank-elevate-everyday-and-travel-rewards-with-the-launch-of-two-new-co-branded-credit-cards/article70734759.ece,neutral,0.8241113424301147,expansion,1.0,0,0.0,0,0,0,0,0,1,0,0,0,0.1954220291755751,0.6938693309856646,0.5,0.0,0.0,0.0,0.6163215985913988
myntra,BusinessLine,2026-03-15,The AI tsunami that is engulfing D2C startups Explore how AI is disrupting D2C startups by transforming search behavior and challenging traditional e-commerce models.,ai tsunami engulfing dc startups explore ai disrupting dc startups transforming search behavior challenging traditional ecommerce models,The AI tsunami that is engulfing D2C startups,https://www.thehindubusinessline.com/specials/emerging-entrepreneurs/the-ai-tsunami-that-is-engulfing-d2c-startups/article70747510.ece,neutral,0.761411726474762,technology,1.0,0,0.0,0,0,1,0,0,0,0,0,0,0.1954220291755751,0.6666587689862268,0.5,0.0,0.0,0.0,0.5999952613917361
myntra,BusinessLine,2026-03-20,"Flipkart CFO Sriram Venkataraman exits ahead of IPO Ahead of its planned public listing, Flipkart’s Group Chief Financial Officer Sriram Venkataraman has stepped down, the company said, marking a key leadership change as it advances IPO preparations.",flipkart cfo sriram venkataraman exits ahead ipo ahead planned public listing flipkarts group chief financial officer sriram venkataraman stepped company said marking key leadership change advances ipo preparations,Flipkart CFO Sriram Venkataraman exits ahead of IPO,https://www.thehindubusinessline.com/companies/flipkart-cfo-sriram-venkataraman-exits-ahead-of-ipo/article70764936.ece,neutral,0.856562077999115,technology,1.0,0,0.0,0,0,1,0,0,0,0,0,0,0.17667577721288502,0.6190402854872107,0.5,0.0,0.0,0.0,0.5714241712923265
myntra,The Times of India,2026-03-20,"Flipkart group CFO Sriram Venkataraman quits amid ecommerce company’s IPO plans Venkatraman, a decade-long company veteran who joined in 2015, will exit over the coming months. Flipkart has not named a successor yet.",flipkart group cfo sriram venkataraman quits amid ecommerce companys ipo plans venkatraman decadelong company veteran joined exit coming months flipkart named successor yet,Flipkart group CFO Sriram Venkataraman quits amid ecommerce company’s IPO plans,https://economictimes.indiatimes.com/tech/technology/flipkart-group-cfo-sriram-venkatraman-quits-amid-ecommerce-companys-ipo-plans/articleshow/129694999.cms,negative,0.7231837511062622,other,0.8,-1,-0.7231837511062622,0,0,0,0,0,0,0,0,1,0.17667577721288502,0.6190402854872107,0.379469374815623,-0.12053062518437702,-0.12053062518437702,0.08716578964402069,0.5232119212185756
